{
  "$schema": "https://json-schema.org/draft/2020-12/schema",
  "$id": "https://github.com/lklimek/claudius/schemas/review-report.schema.json",
  "title": "Claudius Review Report",
  "description": "Intermediate format for code review and PR comment verification reports. Produced by grumpy-review and check-pr-comments, consumed by all renderers.",
  "type": "object",
  "required": ["schema_version", "metadata", "executive_summary", "summary_statistics", "findings"],
  "additionalProperties": false,
  "properties": {
    "schema_version": {
      "type": "string",
      "enum": ["3.0.0", "3.1.0", "3.2.0", "4.0.0"],
      "description": "Schema version (SemVer). Renderers check this for compatibility. 4.0.0 is the only version emitted; 3.x is accepted read-only for in-flight reports, whose findings are migrated to the 4.0.0 float names on load."
    },
    "metadata": {
      "type": "object",
      "required": ["project", "date"],
      "additionalProperties": false,
      "properties": {
        "project": { "type": "string", "description": "Project name or repository URL" },
        "date": { "type": "string", "format": "date", "description": "Review date (YYYY-MM-DD)" },
        "branch": { "type": "string", "description": "Branch reviewed" },
        "commit": {
          "type": "string",
          "pattern": "^[0-9a-f]{40}$",
          "description": "Full 40-char SHA, used for permalink construction. Omit when not in a git repo."
        },
        "base_commit": {
          "type": "string",
          "pattern": "^[0-9a-f]{40}$",
          "description": "Full 40-char merge-base SHA of the reviewed diff (base...commit). post_pr_review.py APPROVEs only when it equals the PR's current merge-base."
        },
        "repository": {
          "type": "object",
          "required": ["owner", "repo"],
          "additionalProperties": false,
          "description": "GitHub owner/repo for permalink construction. Coordinator-derived from git remote; absent for non-GitHub or non-git directories.",
          "properties": {
            "owner": { "type": "string", "minLength": 1 },
            "repo": { "type": "string", "minLength": 1 }
          }
        },
        "scope": { "type": "string", "description": "What was reviewed (paths, commit range, etc.)" },
        "reviewers": {
          "type": "array",
          "items": { "type": "string" },
          "description": "Agent types used (e.g., 'security-engineer', 'rust-developer')"
        },
        "report_type": {
          "type": "string",
          "enum": ["code_review", "comment_check", "pr_audit"],
          "description": "Type of report. Defaults to code_review if omitted."
        },
        "plugin_version": {
          "type": "string",
          "description": "claudius plugin version that produced the report (from .claude-plugin/plugin.json). Auto-filled by consolidate_reports.py prepare."
        },
        "pr_number": {
          "type": "integer",
          "minimum": 1,
          "description": "Pull request number (for PR-scoped reports)"
        }
      }
    },
    "executive_summary": {
      "type": "object",
      "required": ["overall_assessment"],
      "additionalProperties": false,
      "properties": {
        "overall_assessment": { "type": "string", "description": "1-2 sentence overall assessment (plain text)" },
        "summary_text": { "type": "string", "description": "Expanded summary paragraph. Markdown-formatted: may contain headings, bold, code spans, fenced code, and lists. Renderer: scripts/generate_review_report.py." },
        "verdict_text": { "type": "string", "description": "Final verdict. Markdown-formatted: may contain headings, bold, code spans, fenced code, and lists. Renderer: scripts/generate_review_report.py." },
        "verdict_action": { "type": "string", "description": "Recommended action, e.g., 'Approve with conditions' (plain text)" }
      }
    },
    "summary_statistics": {
      "type": "object",
      "required": ["total_findings", "severity_counts"],
      "additionalProperties": false,
      "properties": {
        "total_findings": { "type": "integer", "minimum": 0 },
        "redundancy_ratio": { "type": "string", "description": "e.g., '51%'" },
        "critical_count": { "type": "integer", "minimum": 0 },
        "severity_counts": {
          "type": "object",
          "additionalProperties": false,
          "properties": {
            "CRITICAL": { "type": "integer", "minimum": 0, "default": 0 },
            "HIGH": { "type": "integer", "minimum": 0, "default": 0 },
            "MEDIUM": { "type": "integer", "minimum": 0, "default": 0 },
            "LOW": { "type": "integer", "minimum": 0, "default": 0 },
            "INFO": { "type": "integer", "minimum": 0, "default": 0 }
          }
        },
        "severity_category_matrix": {
          "type": "array",
          "description": "Severity x category matrix rows.",
          "items": {
            "type": "object",
            "required": ["severity", "security", "project", "code_quality", "total"],
            "additionalProperties": false,
            "properties": {
              "severity": { "type": "string", "enum": ["CRITICAL", "HIGH", "MEDIUM", "LOW", "INFO"], "description": "Label for display (string key, not numeric)" },
              "security": { "type": "integer", "minimum": 0 },
              "project": { "type": "integer", "minimum": 0 },
              "code_quality": { "type": "integer", "minimum": 0 },
              "call_tree": { "type": "integer", "minimum": 0 },
              "dependencies": { "type": "integer", "minimum": 0 },
              "documentation": { "type": "integer", "minimum": 0 },
              "pr_comments": { "type": "integer", "minimum": 0 },
              "pr_promises": { "type": "integer", "minimum": 0 },
              "architecture": { "type": "integer", "minimum": 0 },
              "ux": { "type": "integer", "minimum": 0 },
              "total": { "type": "integer", "minimum": 0 }
            }
          }
        },
        "verdict_counts": {
          "type": "object",
          "additionalProperties": false,
          "description": "Verdict breakdown for comment-check reports.",
          "properties": {
            "RESOLVED": { "type": "integer", "minimum": 0, "default": 0 },
            "UNRESOLVED": { "type": "integer", "minimum": 0, "default": 0 }
          }
        },
        "merge_class_counts": {
          "type": "object",
          "description": "Merge classification breakdown for classified findings.",
          "additionalProperties": { "type": "integer", "minimum": 0 }
        }
      }
    },
    "top_findings": {
      "type": "array",
      "description": "Top findings requiring immediate action.",
      "items": {
        "type": "object",
        "required": ["id", "severity", "title", "location"],
        "additionalProperties": false,
        "properties": {
          "id": { "type": "string" },
          "severity": { "$ref": "#/$defs/severity" },
          "merge_class": {
            "type": "string",
            "enum": ["blocking", "non_blocking", "out_of_scope_follow_up", "disputed"]
          },
          "title": { "type": "string" },
          "location": { "type": "string" },
          "location_permalink": {
            "type": "string",
            "format": "uri",
            "pattern": "^https?://",
            "description": "GitHub permalink to the finding location (http/https only). Coordinator-constructed when metadata.commit + metadata.repository + parseable location are all available."
          }
        }
      }
    },
    "findings": {
      "type": "array",
      "description": "All findings grouped by section.",
      "items": { "$ref": "#/$defs/finding_section" }
    },
    "dependencies": {
      "type": "array",
      "description": "Dependency audit results.",
      "items": {
        "type": "object",
        "required": ["package", "version"],
        "additionalProperties": false,
        "properties": {
          "package": { "type": "string" },
          "version": { "type": "string" },
          "advisories": { "type": "string", "description": "Known advisories (CVE, GHSA, RustSec, etc.) or 'None'" },
          "applicable": { "type": "string", "description": "Applicability assessment" },
          "ok": { "type": "boolean", "description": "true if no action needed" }
        }
      }
    },
    "agent_stats": {
      "type": "array",
      "description": "Per-agent unique vs redundant finding counts.",
      "items": {
        "type": "object",
        "required": ["agent", "unique", "redundant"],
        "additionalProperties": false,
        "properties": {
          "agent": { "type": "string" },
          "unique": { "type": "integer", "minimum": 0 },
          "redundant": { "type": "integer", "minimum": 0 }
        }
      }
    },
    "remediation": {
      "type": "array",
      "description": "Remediation priority buckets.",
      "items": {
        "type": "object",
        "required": ["label", "count", "priority"],
        "additionalProperties": false,
        "properties": {
          "label": { "type": "string", "description": "e.g., 'Before Merge'" },
          "count": { "type": "integer", "minimum": 0 },
          "priority": {
            "type": "string",
            "enum": ["before_merge", "before_production", "post_deployment"]
          },
          "finding_ids": {
            "type": "array",
            "items": { "type": "string" },
            "description": "IDs of findings in this bucket"
          }
        }
      }
    },
    "triage": {
      "type": "object",
      "description": "Triage decisions overlay. Added by triage-findings, absent in raw review output.",
      "additionalProperties": false,
      "properties": {
        "triaged_by": { "type": "string" },
        "triaged_at": { "type": "string", "format": "date-time" },
        "decisions": {
          "type": "array",
          "items": { "$ref": "#/$defs/triage_decision" }
        }
      }
    }
  },
  "$defs": {
    "severity": {
      "type": "integer",
      "minimum": 1,
      "maximum": 5,
      "description": "Numeric severity: 5=CRITICAL, 4=HIGH, 3=MEDIUM, 2=LOW, 1=INFO. Coordinator-derived from overall_severity via the band table. Optional on producer/standalone reports; renderers derive it on-the-fly from likelihood/impact when absent."
    },
    "severity_float": {
      "type": "number",
      "minimum": 0.0,
      "maximum": 1.0,
      "description": "Normalized score in [0.0, 1.0]."
    },
    "finding": {
      "type": "object",
      "required": ["id", "title", "location", "description", "recommendation", "likelihood", "impact", "relevance"],
      "additionalProperties": false,
      "properties": {
        "id": {
          "type": "string",
          "pattern": "^(SEC|QA|PROJ|CODE|RUST|PY|GO|FE|DOC|CMT|DEP|PPM|CALL|ARCH|UX)-\\d{3}$",
          "description": "Finding ID with category prefix (SEC→security, PROJ→project, CODE/RUST/PY/GO/FE/QA→code_quality, DOC→documentation, CMT→pr_comments, DEP→dependencies, PPM→pr_promises, CALL→call_tree, ARCH→architecture, UX→ux)"
        },
        "severity": { "$ref": "#/$defs/severity" },
        "merge_class": {
          "type": "string",
          "enum": ["blocking", "non_blocking", "out_of_scope_follow_up", "disputed"],
          "description": "Merge classification — whether this finding prevents this PR from merging; orthogonal to severity."
        },
        "intent_basis": {
          "type": ["string", "null"],
          "description": "Justification for a blocking class; null or absent otherwise. For merge_class=blocking this MUST cite the tripped blocker gate as 'G-ID: evidence' (e.g. 'G-SECRET: seed phrase written to debug log at wallet/import.rs:88') using a gate ID from severity_util.GATE_IDS \u2014 see skills/severity/SKILL.md \u00a72. A bare requirement quote is flagged by validate_report.py's consistency gate."
        },
        "likelihood": { "$ref": "#/$defs/severity_float", "description": "Probability a real user or attacker reaches this defect under zone-realistic usage (1.0 happy path, ~0.7 workflow-plausible, ~0.4 edge case, ~0.1 pathological). See skills/severity/SKILL.md (source of truth)." },
        "impact": { "$ref": "#/$defs/severity_float", "description": "Worst plausible outcome, capped by the finding's backstop zone; blast radius folds in here (1.0 irreversible loss of funds/keys/data, ~0.7 recoverable loss or unrecoverable-stuck user, ~0.4 failed task or scary UX, ~0.1 cosmetic)." },
        "relevance": { "$ref": "#/$defs/severity_float", "description": "Fit to what this PR set out to do (1.0 the very thing, ~0.5 adjacent code the PR touched, ~0.1 pre-existing and unrelated, 0.0 informational). Drives merge_class and report ordering; deliberately NOT an input to overall_severity." },
        "overall_severity": { "$ref": "#/$defs/severity_float", "description": "Coordinator-computed mean of likelihood and impact." },
        "author_type": {
          "type": "string",
          "enum": ["bot", "human"],
          "description": "Comment author classification (check-pr-comments)."
        },
        "title": { "type": "string", "minLength": 1 },
        "tags": {
          "type": "array",
          "items": { "type": "string" },
          "description": "Classification tags (OWASP, CWE, Rust best-practice IDs, etc.)"
        },
        "cross_domain_hint": {
          "type": "string",
          "description": "Peer reviewer role whose primary domain owns an issue this producer noticed incidentally (grumpy-review §3), letting consolidation weigh the overlap."
        },
        "location": { "type": "string", "minLength": 1, "description": "file:start_line-end_line" },
        "location_permalink": {
          "type": "string",
          "format": "uri",
          "pattern": "^https?://",
          "description": "Coordinator-constructed GitHub blob URL at metadata.commit (http/https only). Absent when commit/repository/parseable location is missing."
        },
        "description": { "type": "string", "minLength": 1, "description": "Markdown-formatted description of the finding. May contain headings, bold, code spans, fenced code, and lists. Renderer: scripts/generate_review_report.py." },
        "impact_description": { "type": "string", "description": "Markdown-formatted impact narrative. Same Markdown subset as description. Optional; the numeric impact field is separate." },
        "recommendation": { "type": "string", "minLength": 1, "description": "Markdown-formatted remediation guidance. Same Markdown subset as description." },
        "code_snippets": {
          "type": "array",
          "minItems": 1,
          "description": "Producer-captured code excerpts illustrating the finding. Optional; absent when the producer captured none.",
          "items": {
            "type": "object",
            "required": ["content"],
            "additionalProperties": false,
            "properties": {
              "language": { "type": "string", "description": "Syntax-highlight hint, e.g., 'rust', 'python'." },
              "caption": { "type": "string", "description": "Short label, e.g., 'auth.rs:42-58'." },
              "content": { "type": "string", "description": "Verbatim code text. Renderers HTML-escape it; never treated as Markdown." }
            }
          }
        },
        "ai_assessment": { "type": "string", "description": "Validate-findings LLM rationale (Markdown)." },
        "ai_verdict": {
          "type": "string",
          "enum": ["valid", "false_positive", "needs_investigation", "out_of_scope", "duplicate"],
          "description": "Validate-findings LLM verdict."
        },
        "ai_verdict_confidence": { "$ref": "#/$defs/severity_float", "description": "Validate-findings confidence in [0,1]. Renderers fade the verdict chip toward the page background as confidence drops." },
        "reviewer": { "type": "string", "description": "GitHub username of the comment author" },
        "comment_id": { "type": "integer", "description": "GitHub REST API comment database ID" },
        "comment_url": { "type": "string", "format": "uri", "pattern": "^https?://", "description": "Direct URL to the review comment on GitHub (https/http only)" },
        "thread_id": { "type": "string", "description": "GraphQL node ID for the review thread (used for resolving)" },
        "verdict": {
          "type": "string",
          "enum": ["RESOLVED", "UNRESOLVED"],
          "description": "Whether the PR review comment has been addressed in code"
        }
      }
    },
    "finding_section": {
      "type": "object",
      "required": ["title", "category", "findings"],
      "additionalProperties": false,
      "properties": {
        "title": { "type": "string", "description": "Section heading" },
        "subtitle": { "type": "string" },
        "category": {
          "type": "string",
          "enum": ["security", "project", "code_quality", "call_tree", "dependencies", "documentation", "pr_comments", "pr_promises", "architecture", "ux"]
        },
        "findings": {
          "type": "array",
          "items": { "$ref": "#/$defs/finding" }
        },
        "positives": { "type": "string", "description": "Positive observations for this section" },
        "verdict": {
          "type": "string",
          "enum": ["PASS", "FAIL", "NEEDS_REVIEW"],
          "description": "Section-level audit verdict (review-pr Pass C)."
        }
      }
    },
    "finding_section_array": {
      "type": "array",
      "description": "Producer-stage output containing finding sections before consolidation.",
      "items": { "$ref": "#/$defs/finding_section" }
    },
    "triage_decision": {
      "type": "object",
      "required": ["finding_id", "action"],
      "additionalProperties": false,
      "properties": {
        "finding_id": { "type": "string", "description": "References a finding ID" },
        "action": {
          "type": "string",
          "enum": ["fix", "accept_risk", "defer", "false_positive", "duplicate"]
        },
        "rationale": { "type": "string" },
        "assignee": { "type": "string" },
        "due_date": { "type": "string", "format": "date" },
        "ticket": { "type": "string", "description": "Issue tracker reference" },
        "resolve_thread": {
          "type": "boolean",
          "default": false,
          "description": "If true, resolve the associated GitHub review thread after triage"
        }
      }
    }
  }
}
